{"schemaVersion":"1","eventType":"HTTP_TRANSACTION","direction":"INBOUND","timestamp":"2026-08-26T22:00:00Z","correlation":{"exchangeId":"ex-1","outboundCount":1,"onDemandTag":"BUG-1234"},"method":"GET","route":"/widgets/{id}","path":"/widgets/123","query":{},"fingerprints":{"endpoint":{"id":"e1","label":"INBOUND GET /widgets/{id}"},"scenario":{"id":"s1","label":"INBOUND GET /widgets/{id} shape=none resp=200"}},"requestShape":"none","responseCharacteristic":"200","latencyMs":18,"request":{"headers":{"Accept":["application/json"]},"contentType":null,"body":{"encoding":"EMPTY","body":null,"truncated":false,"sizeBytes":0,"capturedBytes":0}},"response":{"status":200,"headers":{"Content-Type":["application/json"]},"contentType":"application/json","body":{"encoding":"JSON","body":{"id":"123"},"truncated":false,"sizeBytes":10,"capturedBytes":10}}}
